{
  "apiVersion": "nexoharness.dev/v1alpha1",
  "kind": "Directive",
  "metadata": { "id": "core-directive-fixture", "title": "Fixture Directive", "version": "0.1.0", "status": "draft" },
  "spec": {
    "summary": "A valid directive fixture.",
    "appliesTo": ["coding-agent"],
    "invariants": ["context-before-action"]
  }
}
